<?xml version="1.0" encoding="UTF-8"?>
<!DOCTYPE dataset SYSTEM "../../../../../../../droidDbUnit.dtd">

<dataset> 
   <FORMAT PUID="fmt/richard"/>
   <FORMAT PUID="fmt/matt"/>
   <FORMAT PUID="fmt/alok"/>
   <FORMAT PUID="NONE"/>

   <PROFILE_RESOURCE_NODE URI="file:/dir1/"           NAME="dir1" LAST_MODIFIED_DATE="2009-01-01 12:00:00"	NODE_ID="1"   RESOURCE_TYPE="0" PREFIX="AA" PREFIX_PLUS_ONE="AB"  EXTENSION_MISMATCH="0"/>
   <PROFILE_RESOURCE_NODE URI="file:/unreadable/"     NAME="unreadable" LAST_MODIFIED_DATE="2009-01-01 12:00:00"  NODE_ID="2"   RESOURCE_TYPE="0" PREFIX="AA" PREFIX_PLUS_ONE="AB" EXTENSION_MISMATCH="0"/>
   <PROFILE_RESOURCE_NODE URI="file:/dir1/file1.exe"  NODE_STATUS="1" LAST_MODIFIED_DATE="2010-01-01 12:00:00"	NODE_ID="11"  NAME="file1.exe" FILE_SIZE="256"  PARENT_ID="1" RESOURCE_TYPE="2" EXTENSION_MISMATCH="0"/>
   <PROFILE_RESOURCE_NODE URI="file:/dir1/file2.doc"  NODE_STATUS="1" LAST_MODIFIED_DATE="2010-01-01 12:00:00"	NODE_ID="12"  EXTENSION = "doc"  NAME="file2.doc" FILE_SIZE="256"  PARENT_ID="1" RESOURCE_TYPE="2" EXTENSION_MISMATCH="0"/>

   <PROFILE_RESOURCE_NODE URI="file:/dir1/file4.droid" NODE_STATUS="1" LAST_MODIFIED_DATE="2008-01-01 12:00:00"  NODE_ID="14"	NAME="file4.droid" FILE_SIZE="230"  PARENT_ID="1" RESOURCE_TYPE="1" EXTENSION_MISMATCH="0"/>
   <PROFILE_RESOURCE_NODE URI="file:/dir1/file5.txt"   NODE_STATUS="1" LAST_MODIFIED_DATE="2007-01-01 12:00:00"  NODE_ID="15"	NAME="file5.txt" FILE_SIZE="4000" PARENT_ID="1" RESOURCE_TYPE="2" EXTENSION_MISMATCH="0"/>
   <PROFILE_RESOURCE_NODE URI="file:/dir1/file6.doc"   NODE_STATUS="1" LAST_MODIFIED_DATE="2007-01-01 12:00:00"   NODE_ID="16"	NAME="file6.doc" FILE_SIZE="8000" PARENT_ID="1" RESOURCE_TYPE="2"  EXTENSION_MISMATCH="0"/>
   <PROFILE_RESOURCE_NODE URI="file:/dir1/file3.xls"   NODE_STATUS="3" LAST_MODIFIED_DATE="2008-01-01 12:00:00"  NODE_ID="13"	NAME="file3.xls" FILE_SIZE="140"   PARENT_ID="1" RESOURCE_TYPE="2" EXTENSION_MISMATCH="0"/>   

   <IDENTIFICATION NODE_ID="14" PUID="fmt/richard"/>
   <IDENTIFICATION NODE_ID="13" PUID="fmt/richard"/>   
   <IDENTIFICATION NODE_ID="15" PUID="fmt/matt"/>
   <IDENTIFICATION NODE_ID="16" PUID="fmt/matt"/>
   
   <IDENTIFICATION NODE_ID="1" PUID="NONE"/>
   <IDENTIFICATION NODE_ID="11" PUID="fmt/alok"/>
   <IDENTIFICATION NODE_ID="12" PUID="fmt/alok"/>
   
</dataset>
