<?xml version="1.0" encoding="UTF-8"?>
<!DOCTYPE dataset SYSTEM "../../../../../droidDbUnit.dtd">

<dataset> 
   <FORMAT PUID="fmt/alok"/>
   <FORMAT PUID="NONE"/>

   <PROFILE_RESOURCE_NODE NODE_ID="1"  EXTENSION_MISMATCH="0" NAME="dir1"  RESOURCE_TYPE="2" PREFIX="AA" PREFIX_PLUS_ONE="AB" URI="file:/dir1/"/>
   <PROFILE_RESOURCE_NODE NODE_ID="11" EXTENSION_MISMATCH="0" EXTENSION="exe" NAME="file1.exe" NODE_STATUS="1" RESOURCE_TYPE="1" FILE_SIZE="256" PREFIX="AAA" PREFIX_PLUS_ONE="AAB" URI="file:/dir1/file1.exe" PARENT_ID="1"/>
   <PROFILE_RESOURCE_NODE NODE_ID="12" EXTENSION_MISMATCH="0" EXTENSION="doc" NAME="file2.doc" NODE_STATUS="1" RESOURCE_TYPE="1" FILE_SIZE="256" PREFIX="AAB" PREFIX_PLUS_ONE="AAC" URI="file:/dir1/file2.doc" PARENT_ID="1"/>
   
   
   <IDENTIFICATION NODE_ID="11" PUID="fmt/alok"/>
   <IDENTIFICATION NODE_ID="12" PUID="fmt/alok"/>
   <IDENTIFICATION NODE_ID="1" PUID="NONE"/>
</dataset>
